{
  "type": "delivery",
  "id": "dl-003",
  "project": "2026-10-12-jev-valuation",
  "from": "04-copywriter",
  "to": "05-visual",
  "in_reply_to": "tc-002",
  "artifacts": [
    "04-copywriter/projects/2026-10-12-jev-valuation/draft.md"
  ],
  "summary": "定稿完成，核心观点：小创新",
  "questions_for_user": []
}
